{"$schema":"https://json-schema.org/draft/2020-12/schema","$id":"novi.authorization-decision/1.0.0","title":"AuthorizationDecision","type":"object","additionalProperties":false,"required":["decision_id","principal","capability","target","purpose","scope","policy_version","state_revision","decision","valid_from","valid_until","provenance"],"properties":{"decision_id":{"type":"string"},"principal":{},"capability":{"type":"string"},"target":{},"purpose":{},"scope":{},"policy_version":{"type":"string"},"state_revision":{"type":"integer","minimum":0},"decision":{"type":"string"},"conditions":{},"valid_from":{"type":"string","format":"date-time"},"valid_until":{"type":"string","format":"date-time"},"approver_source":{},"provenance":{}}}